{
  "version": "v1",
  "generatedAt": "2026-04-07T23:41:59.313Z",
  "leaderboard": {
    "count": 23,
    "providers": [
      {
        "provider": "hyperbolic",
        "avgScore": 0.9670455877395655,
        "dataPoints": 84,
        "modelCount": 2
      },
      {
        "provider": "moonshotai",
        "avgScore": 0.9665099742994115,
        "dataPoints": 55,
        "modelCount": 1
      },
      {
        "provider": "sambanova",
        "avgScore": 0.9658765479499577,
        "dataPoints": 49,
        "modelCount": 2
      },
      {
        "provider": "clarifai",
        "avgScore": 0.9658405513232462,
        "dataPoints": 98,
        "modelCount": 2
      },
      {
        "provider": "nextbit",
        "avgScore": 0.9652676540294359,
        "dataPoints": 45,
        "modelCount": 1
      },
      {
        "provider": "together",
        "avgScore": 0.9604271615243067,
        "dataPoints": 250,
        "modelCount": 5
      },
      {
        "provider": "fireworks",
        "avgScore": 0.9597090970410532,
        "dataPoints": 107,
        "modelCount": 3
      },
      {
        "provider": "deepinfra",
        "avgScore": 0.9558132045010738,
        "dataPoints": 217,
        "modelCount": 6
      },
      {
        "provider": "phala",
        "avgScore": 0.953994974753277,
        "dataPoints": 35,
        "modelCount": 1
      },
      {
        "provider": "nebius",
        "avgScore": 0.953687673806564,
        "dataPoints": 196,
        "modelCount": 5
      },
      {
        "provider": "groq",
        "avgScore": 0.9536693065542483,
        "dataPoints": 121,
        "modelCount": 3
      },
      {
        "provider": "wandb",
        "avgScore": 0.9533604707966443,
        "dataPoints": 209,
        "modelCount": 4
      },
      {
        "provider": "parasail",
        "avgScore": 0.9506631482374602,
        "dataPoints": 108,
        "modelCount": 3
      },
      {
        "provider": "chutes",
        "avgScore": 0.9505310442709226,
        "dataPoints": 23,
        "modelCount": 4
      },
      {
        "provider": "google-vertex",
        "avgScore": 0.9501374519558144,
        "dataPoints": 119,
        "modelCount": 5
      },
      {
        "provider": "cerebras",
        "avgScore": 0.9478248330993709,
        "dataPoints": 39,
        "modelCount": 2
      },
      {
        "provider": "siliconflow",
        "avgScore": 0.9454099991180998,
        "dataPoints": 157,
        "modelCount": 5
      },
      {
        "provider": "crusoe",
        "avgScore": 0.945094114325731,
        "dataPoints": 11,
        "modelCount": 1
      },
      {
        "provider": "novita",
        "avgScore": 0.9445834615620669,
        "dataPoints": 307,
        "modelCount": 6
      },
      {
        "provider": "baseten",
        "avgScore": 0.9288587302815572,
        "dataPoints": 92,
        "modelCount": 2
      },
      {
        "provider": "atlas-cloud",
        "avgScore": 0.9209159112138208,
        "dataPoints": 109,
        "modelCount": 5
      },
      {
        "provider": "venice",
        "avgScore": 0.9190814467674383,
        "dataPoints": 4,
        "modelCount": 1
      },
      {
        "provider": "alibaba",
        "avgScore": 0.8739035126204397,
        "dataPoints": 126,
        "modelCount": 3
      }
    ]
  },
  "models": [
    {
      "model": "Qwen/Qwen3-235B-A22B-Instruct-2507",
      "id": "Qwen%2FQwen3-235B-A22B-Instruct-2507",
      "lastTimestamp": "2026-04-05T00:50:26Z",
      "latestRun": {
        "id": "Qwen_Qwen3-235B-A22B-Instruct-2507_audit_results_20260405_005026",
        "timestamp": "2026-04-05T00:50:26Z",
        "dataUrl": "../../data/Qwen_Qwen3-235B-A22B-Instruct-2507_audit_results_20260405_005026.json",
        "providerCount": 0,
        "providerEntries": []
      }
    },
    {
      "model": "Qwen/Qwen3-32B",
      "id": "Qwen%2FQwen3-32B",
      "lastTimestamp": "2026-04-05T02:53:20Z",
      "latestRun": {
        "id": "Qwen_Qwen3-32B_audit_results_20260405_025320",
        "timestamp": "2026-04-05T02:53:20Z",
        "dataUrl": "../../data/Qwen_Qwen3-32B_audit_results_20260405_025320.json",
        "providerCount": 0,
        "providerEntries": []
      }
    },
    {
      "model": "Qwen/Qwen3-Coder-480B-A35B-Instruct",
      "id": "Qwen%2FQwen3-Coder-480B-A35B-Instruct",
      "lastTimestamp": "2026-04-05T02:29:06Z",
      "latestRun": {
        "id": "Qwen_Qwen3-Coder-480B-A35B-Instruct_audit_results_20260405_022906",
        "timestamp": "2026-04-05T02:29:06Z",
        "dataUrl": "../../data/Qwen_Qwen3-Coder-480B-A35B-Instruct_audit_results_20260405_022906.json",
        "providerCount": 5,
        "providerEntries": [
          {
            "endpoint": "deepinfra/fp4",
            "provider": "deepinfra",
            "variant": "fp4"
          },
          {
            "endpoint": "deepinfra/fp8",
            "provider": "deepinfra",
            "variant": "fp8"
          },
          {
            "endpoint": "google-vertex",
            "provider": "google-vertex",
            "variant": null
          },
          {
            "endpoint": "novita/fp8",
            "provider": "novita",
            "variant": "fp8"
          },
          {
            "endpoint": "together/fp8",
            "provider": "together",
            "variant": "fp8"
          }
        ]
      }
    },
    {
      "model": "claude-opus-4-6",
      "id": "claude-opus-4-6",
      "lastTimestamp": "2026-04-05T03:33:24Z",
      "latestRun": {
        "id": "claude-opus-4-6_audit_results_20260405_033324",
        "timestamp": "2026-04-05T03:33:24Z",
        "dataUrl": "../../data/claude-opus-4-6_audit_results_20260405_033324.json",
        "providerCount": 4,
        "providerEntries": [
          {
            "endpoint": "anthropic",
            "provider": "anthropic",
            "variant": null
          },
          {
            "endpoint": "azure",
            "provider": "azure",
            "variant": null
          },
          {
            "endpoint": "bedrock",
            "provider": "bedrock",
            "variant": null
          },
          {
            "endpoint": "vertex",
            "provider": "vertex",
            "variant": null
          }
        ]
      }
    },
    {
      "model": "claude-sonnet-4-5",
      "id": "claude-sonnet-4-5",
      "lastTimestamp": "2026-04-05T03:33:24Z",
      "latestRun": {
        "id": "claude-sonnet-4-5_audit_results_20260405_033324",
        "timestamp": "2026-04-05T03:33:24Z",
        "dataUrl": "../../data/claude-sonnet-4-5_audit_results_20260405_033324.json",
        "providerCount": 4,
        "providerEntries": [
          {
            "endpoint": "anthropic",
            "provider": "anthropic",
            "variant": null
          },
          {
            "endpoint": "azure",
            "provider": "azure",
            "variant": null
          },
          {
            "endpoint": "bedrock",
            "provider": "bedrock",
            "variant": null
          },
          {
            "endpoint": "vertex",
            "provider": "vertex",
            "variant": null
          }
        ]
      }
    },
    {
      "model": "claude-sonnet-4-6",
      "id": "claude-sonnet-4-6",
      "lastTimestamp": "2026-04-05T03:33:24Z",
      "latestRun": {
        "id": "claude-sonnet-4-6_audit_results_20260405_033324",
        "timestamp": "2026-04-05T03:33:24Z",
        "dataUrl": "../../data/claude-sonnet-4-6_audit_results_20260405_033324.json",
        "providerCount": 0,
        "providerEntries": []
      }
    },
    {
      "model": "deepseek-v3-2",
      "id": "deepseek-v3-2",
      "lastTimestamp": "2026-04-05T03:33:24Z",
      "latestRun": {
        "id": "deepseek-v3-2_audit_results_20260405_033324",
        "timestamp": "2026-04-05T03:33:24Z",
        "dataUrl": "../../data/deepseek-v3-2_audit_results_20260405_033324.json",
        "providerCount": 7,
        "providerEntries": [
          {
            "endpoint": "azure",
            "provider": "azure",
            "variant": null
          },
          {
            "endpoint": "bedrock",
            "provider": "bedrock",
            "variant": null
          },
          {
            "endpoint": "deepinfra",
            "provider": "deepinfra",
            "variant": null
          },
          {
            "endpoint": "fireworks",
            "provider": "fireworks",
            "variant": null
          },
          {
            "endpoint": "novita",
            "provider": "novita",
            "variant": null
          },
          {
            "endpoint": "parasail",
            "provider": "parasail",
            "variant": null
          },
          {
            "endpoint": "vertex",
            "provider": "vertex",
            "variant": null
          }
        ]
      }
    },
    {
      "model": "gemini-3-1-flash",
      "id": "gemini-3-1-flash",
      "lastTimestamp": "2026-04-05T03:33:24Z",
      "latestRun": {
        "id": "gemini-3-1-flash_audit_results_20260405_033324",
        "timestamp": "2026-04-05T03:33:24Z",
        "dataUrl": "../../data/gemini-3-1-flash_audit_results_20260405_033324.json",
        "providerCount": 0,
        "providerEntries": []
      }
    },
    {
      "model": "gemini-3-1-pro",
      "id": "gemini-3-1-pro",
      "lastTimestamp": "2026-04-05T03:33:24Z",
      "latestRun": {
        "id": "gemini-3-1-pro_audit_results_20260405_033324",
        "timestamp": "2026-04-05T03:33:24Z",
        "dataUrl": "../../data/gemini-3-1-pro_audit_results_20260405_033324.json",
        "providerCount": 0,
        "providerEntries": []
      }
    },
    {
      "model": "glm5",
      "id": "glm5",
      "lastTimestamp": "2026-04-05T03:33:24Z",
      "latestRun": {
        "id": "glm5_audit_results_20260405_033324",
        "timestamp": "2026-04-05T03:33:24Z",
        "dataUrl": "../../data/glm5_audit_results_20260405_033324.json",
        "providerCount": 8,